number,value,datetime_start,datetime_complete,duration,params_d_model,params_learning_rate,params_num_heads,params_surrogate,params_surrogate_alpha,params_tau,state
0,27.092113494873047,2026-04-19 20:33:40.195961,2026-04-19 20:36:06.324383,0 days 00:02:26.128422,8,0.0002049268011541737,8,Sigmoid,2.0,2.0,COMPLETE
1,1.1148488521575928,2026-04-19 20:36:06.324628,2026-04-19 20:38:57.238922,0 days 00:02:50.914294,64,0.00019485671251272575,32,ATan,5.5,3.0,COMPLETE
2,0.6488509774208069,2026-04-19 20:38:57.239165,2026-04-19 20:41:48.782750,0 days 00:02:51.543585,16,0.0007648565112369955,4,Sigmoid,3.0,2.0,COMPLETE
3,1.237710952758789,2026-04-19 20:41:48.782940,2026-04-19 20:44:41.764963,0 days 00:02:52.982023,16,0.00040375061884407573,8,ATan,7.0,2.0,COMPLETE
4,6.69411039352417,2026-04-19 20:44:41.765236,2026-04-19 20:47:36.719030,0 days 00:02:54.953794,32,0.0001573468512939367,2,ATan,3.5,8.0,COMPLETE
5,,2026-04-19 20:47:36.719291,2026-04-19 20:47:36.719562,0 days 00:00:00.000271,4,,16,,,,PRUNED
6,0.7189415097236633,2026-04-19 20:47:36.719691,2026-04-19 20:50:27.470936,0 days 00:02:50.751245,64,0.0002651795441046286,4,Sigmoid,7.5,2.0,COMPLETE
7,1.0169674158096313,2026-04-19 20:50:27.471225,2026-04-19 20:52:13.880974,0 days 00:01:46.409749,8,0.0033299080375866637,4,ATan,7.0,9.0,COMPLETE
8,0.5373876690864563,2026-04-19 20:52:13.881226,2026-04-19 20:54:25.316842,0 days 00:02:11.435616,64,0.0015646172845245534,2,ATan,4.5,3.0,COMPLETE
9,,2026-04-19 20:54:25.317033,2026-04-19 20:54:25.317238,0 days 00:00:00.000205,8,,16,,,,PRUNED
10,0.759408175945282,2026-04-19 20:54:25.317336,2026-04-19 20:57:14.585318,0 days 00:02:49.267982,64,0.0020107005213499908,2,SoftSign,5.0,5.0,COMPLETE
11,1.143938422203064,2026-04-19 20:57:14.585566,2026-04-19 21:00:06.721500,0 days 00:02:52.135934,16,0.0010775081933558418,4,Sigmoid,3.0,5.0,COMPLETE
12,0.5849049091339111,2026-04-19 21:00:06.721754,2026-04-19 21:02:59.734189,0 days 00:02:53.012435,16,0.0010121683418163729,2,SoftSign,1.0,4.0,COMPLETE
13,1.2644641399383545,2026-04-19 21:02:59.734395,2026-04-19 21:05:52.656512,0 days 00:02:52.922117,4,0.0015660214793169413,2,SoftSign,1.0,4.0,COMPLETE
14,0.9982126951217651,2026-04-19 21:05:52.656707,2026-04-19 21:07:29.539241,0 days 00:01:36.882534,32,0.004725490307125084,2,SoftSign,1.5,6.0,COMPLETE
15,0.5405191779136658,2026-04-19 21:07:29.539507,2026-04-19 21:10:16.928970,0 days 00:02:47.389463,64,0.0005143344218918389,2,SoftSign,6.0,4.0,COMPLETE
16,0.5945947170257568,2026-04-19 21:10:16.929178,2026-04-19 21:13:04.993289,0 days 00:02:48.064111,64,0.000479127267840989,32,SoftSign,6.0,7.0,COMPLETE
17,29.47573471069336,2026-04-19 21:13:04.993573,2026-04-19 21:15:53.508094,0 days 00:02:48.514521,64,0.00010703022243901653,2,ATan,6.0,4.0,COMPLETE
18,0.6038522124290466,2026-04-19 21:15:53.508277,2026-04-19 21:18:42.146182,0 days 00:02:48.637905,64,0.00047869424251291274,2,SoftSign,4.0,10.0,COMPLETE
19,0.6295732259750366,2026-04-19 21:18:42.146562,2026-04-19 21:21:31.352719,0 days 00:02:49.206157,64,0.0018876513253530897,2,ATan,4.5,6.0,COMPLETE
20,1.0218321084976196,2026-04-19 21:21:31.352940,2026-04-19 21:23:11.308507,0 days 00:01:39.955567,64,0.002834952035654419,16,ATan,6.5,3.0,COMPLETE
21,1.3332087993621826,2026-04-19 21:23:11.308770,2026-04-19 21:26:06.328505,0 days 00:02:55.019735,16,0.0010037058231971625,2,SoftSign,8.0,4.0,COMPLETE
22,0.7437289953231812,2026-04-19 21:26:06.328757,2026-04-19 21:29:01.037843,0 days 00:02:54.709086,16,0.0011541974858384758,2,SoftSign,2.5,3.0,COMPLETE
23,0.5250173807144165,2026-04-19 21:29:01.038096,2026-04-19 21:31:55.400202,0 days 00:02:54.362106,32,0.0006854586673902404,2,SoftSign,5.0,5.0,COMPLETE
24,0.7500641942024231,2026-04-19 21:31:55.400451,2026-04-19 21:34:50.006090,0 days 00:02:54.605639,32,0.0006477231985156303,2,SoftSign,4.5,5.0,COMPLETE
25,1.0487643480300903,2026-04-19 21:34:50.006371,2026-04-19 21:37:45.467742,0 days 00:02:55.461371,32,0.0003274628433322929,32,SoftSign,5.0,7.0,COMPLETE
26,0.6346995830535889,2026-04-19 21:37:45.468023,2026-04-19 21:40:39.537186,0 days 00:02:54.069163,32,0.0006925385557397822,8,SoftSign,5.5,5.0,COMPLETE
27,0.8295767307281494,2026-04-19 21:40:39.537375,2026-04-19 21:43:32.366025,0 days 00:02:52.828650,4,0.001491012083235191,2,ATan,4.0,4.0,COMPLETE
28,0.8313704133033752,2026-04-19 21:43:32.366293,2026-04-19 21:46:28.716255,0 days 00:02:56.349962,32,0.0005770860117782654,2,SoftSign,6.0,3.0,COMPLETE
29,0.8989195823669434,2026-04-19 21:46:28.716505,2026-04-19 21:48:57.362829,0 days 00:02:28.646324,8,0.0008617506181678806,8,SoftSign,5.0,7.0,COMPLETE
30,0.9940856695175171,2026-04-19 21:48:57.363097,2026-04-19 21:51:47.807808,0 days 00:02:50.444711,64,0.0003013279567322037,2,Sigmoid,4.0,6.0,COMPLETE
31,0.7223107814788818,2026-04-19 21:51:47.808070,2026-04-19 21:54:42.246297,0 days 00:02:54.438227,16,0.0013463493172977295,2,SoftSign,6.5,4.0,COMPLETE
32,0.813759982585907,2026-04-19 21:54:42.246484,2026-04-19 21:57:01.726661,0 days 00:02:19.480177,64,0.002358831452278856,2,SoftSign,2.0,3.0,COMPLETE
33,,2026-04-19 21:57:01.726905,2026-04-19 21:57:01.728396,0 days 00:00:00.001491,16,,32,,,,PRUNED
34,0.5891830325126648,2026-04-19 21:57:01.728533,2026-04-19 21:59:55.327795,0 days 00:02:53.599262,32,0.0008020724450233734,2,SoftSign,1.0,5.0,COMPLETE
35,0.552978515625,2026-04-19 21:59:55.327960,2026-04-19 22:02:30.732194,0 days 00:02:35.404234,64,0.0005406885958786519,8,SoftSign,5.5,4.0,COMPLETE
36,0.7492738962173462,2026-04-19 22:02:30.732483,2026-04-19 22:05:21.575775,0 days 00:02:50.843292,64,0.0005535979605161269,8,ATan,5.5,2.0,COMPLETE
37,0.8320963382720947,2026-04-19 22:05:21.576031,2026-04-19 22:08:12.615269,0 days 00:02:51.039238,64,0.00039387747631543875,8,Sigmoid,4.5,3.0,COMPLETE
38,0.9060708284378052,2026-04-19 22:08:12.615523,2026-04-19 22:11:04.505681,0 days 00:02:51.890158,64,0.0002549683461964757,8,ATan,5.5,6.0,COMPLETE
39,,2026-04-19 22:11:04.505868,2026-04-19 22:11:04.507088,0 days 00:00:00.001220,4,,8,,,,PRUNED
40,,2026-04-19 22:11:04.507197,2026-04-19 22:11:04.508223,0 days 00:00:00.001026,8,,16,,,,PRUNED
41,0.7888144254684448,2026-04-19 22:11:04.508318,2026-04-19 22:13:58.010816,0 days 00:02:53.502498,16,0.0010466265184194325,4,SoftSign,6.5,4.0,COMPLETE
42,0.7867961525917053,2026-04-19 22:13:58.011114,2026-04-19 22:16:48.791581,0 days 00:02:50.780467,64,0.0008280960708797653,2,SoftSign,3.5,4.0,COMPLETE
43,0.9939990043640137,2026-04-19 22:16:48.791784,2026-04-19 22:19:39.970729,0 days 00:02:51.178945,64,0.00047142286681456456,2,SoftSign,7.0,2.0,COMPLETE
44,0.9084101319313049,2026-04-19 22:19:39.970920,2026-04-19 22:22:33.290173,0 days 00:02:53.319253,16,0.0006356677518090149,8,SoftSign,5.0,5.0,COMPLETE
45,0.749320924282074,2026-04-19 22:22:33.290459,2026-04-19 22:25:25.216365,0 days 00:02:51.925906,32,0.0013442309166383228,4,Sigmoid,6.0,3.0,COMPLETE
46,0.6140064597129822,2026-04-19 22:25:25.216633,2026-04-19 22:28:14.642989,0 days 00:02:49.426356,64,0.0003746794398638719,16,ATan,3.0,4.0,COMPLETE
47,,2026-04-19 22:28:14.643318,2026-04-19 22:28:14.644929,0 days 00:00:00.001611,8,,32,,,,PRUNED
48,0.8118801116943359,2026-04-19 22:28:14.645123,2026-04-19 22:31:09.764994,0 days 00:02:55.119871,4,0.0009250535230978157,2,SoftSign,7.5,5.0,COMPLETE
49,0.8324454426765442,2026-04-19 22:31:09.765208,2026-04-19 22:33:30.181241,0 days 00:02:20.416033,64,0.001800058915020314,2,SoftSign,5.5,2.0,COMPLETE
50,5.51385498046875,2026-04-19 22:33:30.181553,2026-04-19 22:36:22.539436,0 days 00:02:52.357883,16,0.00020740232765975486,2,SoftSign,2.0,4.0,COMPLETE
51,0.8248413801193237,2026-04-19 22:36:22.539706,2026-04-19 22:39:16.837551,0 days 00:02:54.297845,32,0.0007499283625557706,2,SoftSign,1.5,5.0,COMPLETE
52,0.7557836771011353,2026-04-19 22:39:16.837802,2026-04-19 22:41:43.626705,0 days 00:02:26.788903,32,0.001231573876434719,2,SoftSign,1.5,5.0,COMPLETE
53,0.759340763092041,2026-04-19 22:41:43.626857,2026-04-19 22:44:37.443371,0 days 00:02:53.816514,32,0.0008012579939231497,2,SoftSign,1.0,5.0,COMPLETE
54,0.9638895392417908,2026-04-19 22:44:37.443560,2026-04-19 22:47:31.319914,0 days 00:02:53.876354,32,0.0005209723194656609,2,SoftSign,1.0,6.0,COMPLETE
55,0.9957528710365295,2026-04-19 22:47:31.320118,2026-04-19 22:50:22.498241,0 days 00:02:51.178123,32,0.0004317407127398232,2,ATan,5.0,4.0,COMPLETE
56,0.961198627948761,2026-04-19 22:50:22.498496,2026-04-19 22:53:12.016348,0 days 00:02:49.517852,64,0.0006105772585127426,4,SoftSign,4.5,3.0,COMPLETE
57,0.6806402802467346,2026-04-19 22:53:12.016811,2026-04-19 22:56:05.200189,0 days 00:02:53.183378,32,0.0009446941664592628,2,Sigmoid,3.5,4.0,COMPLETE
58,0.9157044291496277,2026-04-19 22:56:05.200454,2026-04-19 22:58:48.101775,0 days 00:02:42.901321,64,0.0016214949176305278,16,SoftSign,2.5,5.0,COMPLETE
59,1.1382886171340942,2026-04-19 22:58:48.102026,2026-04-19 23:01:41.233298,0 days 00:02:53.131272,16,0.00071182255954795,2,ATan,1.0,4.0,COMPLETE
60,1.2874420881271362,2026-04-19 23:01:41.233553,2026-04-19 23:04:10.848120,0 days 00:02:29.614567,64,0.0025762047253129975,32,SoftSign,6.0,10.0,COMPLETE
61,0.8457258343696594,2026-04-19 23:04:10.848389,2026-04-19 23:07:00.330039,0 days 00:02:49.481650,64,0.0004968388779601337,32,SoftSign,6.5,7.0,COMPLETE
62,0.5953564047813416,2026-04-19 23:07:00.330325,2026-04-19 23:09:52.397685,0 days 00:02:52.067360,64,0.000363844566985626,32,SoftSign,6.0,9.0,COMPLETE
63,0.5365567207336426,2026-04-19 23:09:52.397981,2026-04-19 23:12:44.281144,0 days 00:02:51.883163,64,0.001114935923168785,32,SoftSign,5.5,8.0,COMPLETE
64,0.7313788533210754,2026-04-19 23:12:44.281570,2026-04-19 23:14:57.033069,0 days 00:02:12.751499,64,0.001042118938122407,32,SoftSign,4.5,8.0,COMPLETE
65,,2026-04-19 23:14:57.033356,2026-04-19 23:14:57.035075,0 days 00:00:00.001719,4,,8,,,,PRUNED
66,0.4490177035331726,2026-04-19 23:14:57.035207,2026-04-19 23:17:51.678642,0 days 00:02:54.643435,32,0.0011462153981430113,2,SoftSign,5.5,8.0,COMPLETE
67,0.44494953751564026,2026-04-19 23:17:51.679013,2026-04-19 23:20:15.341221,0 days 00:02:23.662208,8,0.0021929948133678325,2,SoftSign,5.5,9.0,COMPLETE
68,,2026-04-19 23:20:15.341478,2026-04-19 23:20:15.343221,0 days 00:00:00.001743,8,,32,,,,PRUNED
69,0.6596688628196716,2026-04-19 23:20:15.343372,2026-04-19 23:22:42.121564,0 days 00:02:26.778192,8,0.0022050957629490917,2,ATan,5.5,9.0,COMPLETE
70,0.9595078229904175,2026-04-19 23:22:42.122113,2026-04-19 23:24:31.891345,0 days 00:01:49.769232,8,0.001975602904610276,8,SoftSign,5.0,8.0,COMPLETE
71,5.337560653686523,2026-04-19 23:24:31.891635,2026-04-19 23:26:29.369082,0 days 00:01:57.477447,8,0.0012031511619205236,2,SoftSign,5.5,9.0,COMPLETE
72,1.5033611059188843,2026-04-19 23:26:29.369358,2026-04-19 23:27:48.111754,0 days 00:01:18.742396,64,0.0034349901661729597,2,SoftSign,5.0,8.0,COMPLETE
73,0.7933470606803894,2026-04-19 23:27:48.112022,2026-04-19 23:30:40.617654,0 days 00:02:52.505632,16,0.0016163285477775464,2,SoftSign,7.0,9.0,COMPLETE
74,0.5621284246444702,2026-04-19 23:30:40.617995,2026-04-19 23:33:10.823741,0 days 00:02:30.205746,64,0.0013906223896851756,2,SoftSign,6.0,8.0,COMPLETE
75,0.7700943350791931,2026-04-19 23:33:10.824012,2026-04-19 23:34:22.757479,0 days 00:01:11.933467,64,0.0031729709177186964,2,SoftSign,5.5,8.0,COMPLETE
76,0.64369136095047,2026-04-19 23:34:22.757738,2026-04-19 23:37:00.717234,0 days 00:02:37.959496,64,0.0014458447786209283,2,SoftSign,6.0,8.0,COMPLETE
77,0.4747120440006256,2026-04-19 23:37:00.717429,2026-04-19 23:39:50.887612,0 days 00:02:50.170183,64,0.001723528850538133,4,Sigmoid,6.5,10.0,COMPLETE
78,0.6309226155281067,2026-04-19 23:39:50.887805,2026-04-19 23:42:41.871610,0 days 00:02:50.983805,64,0.0018290463311420044,4,Sigmoid,6.5,10.0,COMPLETE
79,0.9565783143043518,2026-04-19 23:42:41.871870,2026-04-19 23:45:19.149020,0 days 00:02:37.277150,32,0.0022651720019551598,4,Sigmoid,7.0,10.0,COMPLETE
80,0.38428109884262085,2026-04-19 23:45:19.149313,2026-04-19 23:48:10.138391,0 days 00:02:50.989078,64,0.0011919867846739763,4,Sigmoid,4.0,9.0,COMPLETE
81,0.6756141781806946,2026-04-19 23:48:10.139091,2026-04-19 23:51:02.748090,0 days 00:02:52.608999,64,0.0011494164125000386,4,Sigmoid,4.0,9.0,COMPLETE
82,0.5513028502464294,2026-04-19 23:51:02.748335,2026-04-19 23:53:45.960461,0 days 00:02:43.212126,64,0.0017441844419344573,4,Sigmoid,4.5,10.0,COMPLETE
83,0.701231062412262,2026-04-19 23:53:45.960732,2026-04-19 23:55:31.179661,0 days 00:01:45.218929,64,0.001680121045039321,4,Sigmoid,4.5,10.0,COMPLETE
84,0.6909303665161133,2026-04-19 23:55:31.179930,2026-04-19 23:57:23.971313,0 days 00:01:52.791383,64,0.0020508965897712292,4,Sigmoid,4.0,9.0,COMPLETE
85,1.0105843544006348,2026-04-19 23:57:23.971574,2026-04-19 23:59:27.776854,0 days 00:02:03.805280,64,0.0025721140288835057,4,Sigmoid,5.0,10.0,COMPLETE
86,1.3008488416671753,2026-04-19 23:59:27.777078,2026-04-20 00:01:52.802505,0 days 00:02:25.025427,8,0.0012714199861733023,4,Sigmoid,4.5,10.0,COMPLETE
87,0.6695175766944885,2026-04-20 00:01:52.802709,2026-04-20 00:04:44.799970,0 days 00:02:51.997261,64,0.0014736348699956679,4,Sigmoid,4.0,9.0,COMPLETE
88,0.4671414792537689,2026-04-20 00:04:44.800267,2026-04-20 00:07:36.247927,0 days 00:02:51.447660,32,0.0008693732853441606,4,Sigmoid,5.0,7.0,COMPLETE
89,0.5689231753349304,2026-04-20 00:07:36.248220,2026-04-20 00:10:30.383350,0 days 00:02:54.135130,32,0.0009524614286711624,4,Sigmoid,5.0,7.0,COMPLETE
90,0.5639082193374634,2026-04-20 00:10:30.383656,2026-04-20 00:13:23.812534,0 days 00:02:53.428878,32,0.0011017558155815158,16,Sigmoid,5.5,7.0,COMPLETE
91,0.740570068359375,2026-04-20 00:13:23.812793,2026-04-20 00:15:53.140283,0 days 00:02:29.327490,32,0.0008793569919145086,4,Sigmoid,4.5,9.0,COMPLETE
92,0.5719957947731018,2026-04-20 00:15:53.140554,2026-04-20 00:18:47.984888,0 days 00:02:54.844334,32,0.0006649302768379732,4,Sigmoid,5.0,8.0,COMPLETE
93,0.927548348903656,2026-04-20 00:18:47.985158,2026-04-20 00:21:40.590268,0 days 00:02:52.605110,4,0.0017756081521545053,4,Sigmoid,5.5,10.0,COMPLETE
94,0.5212579369544983,2026-04-20 00:21:40.590547,2026-04-20 00:24:34.636987,0 days 00:02:54.046440,32,0.001293104422482994,4,Sigmoid,4.5,9.0,COMPLETE
95,49.134376525878906,2026-04-20 00:24:34.637231,2026-04-20 00:27:28.642878,0 days 00:02:54.005647,32,0.00010251268200329086,4,ATan,6.0,9.0,COMPLETE
96,0.6175835132598877,2026-04-20 00:27:28.643266,2026-04-20 00:30:22.051694,0 days 00:02:53.408428,32,0.0013076290309699027,4,Sigmoid,3.5,8.0,COMPLETE
97,0.73152095079422,2026-04-20 00:30:22.052445,2026-04-20 00:33:14.591250,0 days 00:02:52.538805,32,0.0011170815369357264,32,ATan,4.0,7.0,COMPLETE
98,0.7996363639831543,2026-04-20 00:33:14.591614,2026-04-20 00:36:08.115604,0 days 00:02:53.523990,32,0.0007492981634731231,4,Sigmoid,6.5,9.0,COMPLETE
99,0.8429504036903381,2026-04-20 00:36:08.115913,2026-04-20 00:39:00.081500,0 days 00:02:51.965587,32,0.000990503332777067,2,Sigmoid,5.0,8.0,COMPLETE
100,0.7721341848373413,2026-04-20 00:39:00.081804,2026-04-20 00:41:38.585652,0 days 00:02:38.503848,32,0.0015027961952255554,2,ATan,5.5,6.0,COMPLETE
101,0.778189480304718,2026-04-20 00:41:38.585871,2026-04-20 00:43:26.641739,0 days 00:01:48.055868,64,0.0008605010742965965,4,Sigmoid,4.5,10.0,COMPLETE
102,0.5803301334381104,2026-04-20 00:43:26.641983,2026-04-20 00:45:31.662164,0 days 00:02:05.020181,64,0.0012214356184083806,4,Sigmoid,4.5,9.0,COMPLETE
103,1.8913602828979492,2026-04-20 00:45:31.662853,2026-04-20 00:47:56.524414,0 days 00:02:24.861561,8,0.0005995751993875611,4,Sigmoid,5.0,10.0,COMPLETE
104,0.6548970937728882,2026-04-20 00:47:56.524574,2026-04-20 00:50:45.546201,0 days 00:02:49.021627,64,0.0020749695548853684,4,Sigmoid,4.5,6.0,COMPLETE
105,0.9876328110694885,2026-04-20 00:50:45.546464,2026-04-20 00:52:51.332892,0 days 00:02:05.786428,64,0.0017393826418314628,32,Sigmoid,5.0,9.0,COMPLETE
106,0.6358737945556641,2026-04-20 00:52:51.333164,2026-04-20 00:55:36.231502,0 days 00:02:44.898338,32,0.0015745398150240825,16,Sigmoid,5.5,9.0,COMPLETE
107,0.9804577231407166,2026-04-20 00:55:36.231777,2026-04-20 00:57:33.599034,0 days 00:01:57.367257,64,0.0018800808841677038,4,SoftSign,4.0,8.0,COMPLETE
108,0.8321778774261475,2026-04-20 00:57:33.599297,2026-04-20 01:00:01.507513,0 days 00:02:27.908216,8,0.001330339517202414,2,ATan,3.5,10.0,COMPLETE
109,1.308606743812561,2026-04-20 01:00:01.507768,2026-04-20 01:02:54.243000,0 days 00:02:52.735232,4,0.0010412991015874135,2,SoftSign,5.5,7.0,COMPLETE
110,0.7310908436775208,2026-04-20 01:02:54.243737,2026-04-20 01:05:16.934616,0 days 00:02:22.690879,64,0.002406783074333349,4,Sigmoid,6.0,2.0,COMPLETE
111,0.7074819207191467,2026-04-20 01:05:16.934913,2026-04-20 01:08:07.397463,0 days 00:02:50.462550,64,0.0005469194989942332,8,SoftSign,6.5,3.0,COMPLETE
112,0.5477456450462341,2026-04-20 01:08:07.397857,2026-04-20 01:10:58.421543,0 days 00:02:51.023686,64,0.00041395133347394043,8,SoftSign,5.5,3.0,COMPLETE
113,0.9386368989944458,2026-04-20 01:10:58.421791,2026-04-20 01:13:30.665677,0 days 00:02:32.243886,64,0.00043099694542579896,8,SoftSign,5.5,3.0,COMPLETE
114,0.6215143799781799,2026-04-20 01:13:30.666037,2026-04-20 01:16:19.427248,0 days 00:02:48.761211,64,0.00043575325645872225,8,SoftSign,6.0,3.0,COMPLETE
115,0.9409103393554688,2026-04-20 01:16:19.427491,2026-04-20 01:19:09.920567,0 days 00:02:50.493076,64,0.0003295282308050337,2,SoftSign,5.0,3.0,COMPLETE
116,0.7275808453559875,2026-04-20 01:19:09.920811,2026-04-20 01:21:47.336171,0 days 00:02:37.415360,32,0.0014290622920843168,32,SoftSign,4.5,2.0,COMPLETE
117,0.6465323567390442,2026-04-20 01:21:47.336377,2026-04-20 01:24:36.706620,0 days 00:02:49.370243,64,0.0007292185022069809,2,SoftSign,5.0,9.0,COMPLETE
118,0.4848589599132538,2026-04-20 01:24:36.706879,2026-04-20 01:27:25.154540,0 days 00:02:48.447661,64,0.0009150790518552326,4,SoftSign,5.5,7.0,COMPLETE
119,0.7695116996765137,2026-04-20 01:27:25.155026,2026-04-20 01:30:19.290526,0 days 00:02:54.135500,32,0.0008368153833718691,2,SoftSign,5.5,7.0,COMPLETE
120,0.8966472148895264,2026-04-20 01:30:19.290777,2026-04-20 01:32:33.297282,0 days 00:02:14.006505,8,0.0011607717421407277,4,SoftSign,6.0,8.0,COMPLETE
121,0.6042486429214478,2026-04-20 01:32:33.297467,2026-04-20 01:34:58.924979,0 days 00:02:25.627512,64,0.0009135190185635266,4,SoftSign,5.0,7.0,COMPLETE
122,0.7864534854888916,2026-04-20 01:34:58.925181,2026-04-20 01:37:23.083625,0 days 00:02:24.158444,64,0.00104392433464256,4,SoftSign,5.5,6.0,COMPLETE
123,0.3815300166606903,2026-04-20 01:37:23.083843,2026-04-20 01:40:13.571836,0 days 00:02:50.487993,64,0.0006838174674743018,4,SoftSign,6.0,10.0,COMPLETE
124,0.6202534437179565,2026-04-20 01:40:13.572239,2026-04-20 01:43:04.987195,0 days 00:02:51.414956,64,0.0006618400529083214,4,SoftSign,6.0,8.0,COMPLETE
125,0.4529005289077759,2026-04-20 01:43:04.987456,2026-04-20 01:45:54.962954,0 days 00:02:49.975498,64,0.000815745339532856,4,SoftSign,6.0,7.0,COMPLETE
126,0.8921595215797424,2026-04-20 01:45:54.963239,2026-04-20 01:48:15.325341,0 days 00:02:20.362102,64,0.0007020620953234353,4,SoftSign,6.5,7.0,COMPLETE
127,0.6306118965148926,2026-04-20 01:48:15.325638,2026-04-20 01:50:55.222024,0 days 00:02:39.896386,64,0.0007843934158794096,4,SoftSign,6.0,7.0,COMPLETE
128,0.8657520413398743,2026-04-20 01:50:55.222223,2026-04-20 01:53:49.054080,0 days 00:02:53.831857,32,0.0007995291641664436,4,SoftSign,6.5,7.0,COMPLETE
129,0.6152926087379456,2026-04-20 01:53:49.054363,2026-04-20 01:56:37.703066,0 days 00:02:48.648703,64,0.0009571091081927429,4,ATan,6.0,6.0,COMPLETE
130,0.6529281735420227,2026-04-20 01:56:37.703264,2026-04-20 01:59:32.428763,0 days 00:02:54.725499,32,0.0012478292014814405,2,SoftSign,7.0,8.0,COMPLETE
131,0.785828709602356,2026-04-20 01:59:32.429031,2026-04-20 02:02:23.560844,0 days 00:02:51.131813,64,0.0005172928573689391,4,SoftSign,5.5,9.0,COMPLETE
132,0.6927164793014526,2026-04-20 02:02:23.561106,2026-04-20 02:05:11.697561,0 days 00:02:48.136455,64,0.00046875355356321916,8,SoftSign,5.5,4.0,COMPLETE
133,0.7377090454101562,2026-04-20 02:05:11.698055,2026-04-20 02:08:03.311248,0 days 00:02:51.613193,64,0.0006079209042916336,16,SoftSign,6.0,10.0,COMPLETE
134,0.5041879415512085,2026-04-20 02:08:03.311673,2026-04-20 02:10:53.556954,0 days 00:02:50.245281,64,0.0009038290308556557,32,SoftSign,5.5,5.0,COMPLETE
135,0.5929263830184937,2026-04-20 02:10:53.557126,2026-04-20 02:13:35.856027,0 days 00:02:42.298901,64,0.000883873607818685,32,SoftSign,5.0,5.0,COMPLETE
136,,2026-04-20 02:13:35.856432,2026-04-20 02:13:35.858681,0 days 00:00:00.002249,4,,32,,,,PRUNED
137,0.4873138964176178,2026-04-20 02:13:35.858859,2026-04-20 02:16:26.558598,0 days 00:02:50.699739,64,0.0011014366768377112,32,SoftSign,6.0,5.0,COMPLETE
138,0.7446495890617371,2026-04-20 02:16:26.558897,2026-04-20 02:19:18.550593,0 days 00:02:51.991696,64,0.0009957489128566872,32,SoftSign,6.0,5.0,COMPLETE
139,,2026-04-20 02:19:18.550850,2026-04-20 02:19:18.552965,0 days 00:00:00.002115,8,,32,,,,PRUNED
140,0.5589072704315186,2026-04-20 02:19:18.553142,2026-04-20 02:22:12.898241,0 days 00:02:54.345099,32,0.0011830442403160115,32,SoftSign,6.5,6.0,COMPLETE
141,0.7151620984077454,2026-04-20 02:22:12.898530,2026-04-20 02:25:02.126368,0 days 00:02:49.227838,64,0.001060063229201036,32,SoftSign,6.0,5.0,COMPLETE
142,0.5209329724311829,2026-04-20 02:25:02.126639,2026-04-20 02:27:52.875357,0 days 00:02:50.748718,64,0.0009323280794412882,32,SoftSign,6.5,5.0,COMPLETE
143,1.0902012586593628,2026-04-20 02:27:52.875648,2026-04-20 02:30:02.693215,0 days 00:02:09.817567,64,0.0009191675037609199,32,SoftSign,6.5,5.0,COMPLETE
144,0.7831732630729675,2026-04-20 02:30:02.693483,2026-04-20 02:32:37.279200,0 days 00:02:34.585717,64,0.0011224820069982901,32,SoftSign,7.0,5.0,COMPLETE
145,0.3935718834400177,2026-04-20 02:32:37.279483,2026-04-20 02:35:27.102049,0 days 00:02:49.822566,64,0.0007700616244185431,32,SoftSign,6.5,6.0,COMPLETE
